Inn,Score,Out,RoB,Pit(cnt),R/O,@Bat,Batter,Pitcher,wWPA,wWE,Play Description
t9,0-1,0,---,"3,(1-1) BSX",R,NYY,Matt Holliday,Craig Kimbrel,33%,50%,Home Run (Fly Ball to Deep LF)
t12,1-1,0,1--,"3,(0-2) LLX",OO,NYY,Ronald Torreyes,Blaine Boyer,-19%,39%,Ground Ball Double Play: Bunt 3B-SS-2B (Short 3B Line)
t16,1-1,0,---,"3,(2-0) BBX",,NYY,Jacoby Ellsbury,Doug Fister,17%,67%,Double to LF (Line Drive to Deep LF)
t16,1-1,0,-2-,"5,(1-2) LSBFX",,NYY,Chase Headley,Doug Fister,14%,80%,Single to CF (Line Drive to Short CF); Ellsbury to 3B
t14,1-1,2,12-,"4,(1-2) FSBS",O,NYY,Ronald Torreyes,Doug Fister,-12%,35%,Strikeout Swinging
