Inn,Score,Out,RoB,Pit(cnt),R/O,@Bat,Batter,Pitcher,wWPA,wWE,Play Description
b13,1-1,1,-2-,"1,(0-0) X",R,BOS,Blake Swihart,Luis Garcia,30%,100%,Ground-rule Double (Line Drive to Deep CF-RF); Nunez Scores
b5,0-1,1,1--,"1,(0-0) 1X",R,BOS,Eduardo Nunez,Aaron Nola,21%,63%,Triple to CF (Line Drive to Deep CF); Bradley Scores; Nunez to 3B
b9,1-1,0,1--,"2,(1-0) BX",OO,BOS,Mitch Moreland,Seranthony Dominguez,-18%,54%,Ground Ball Double Play: 2B-SS-1B
b5,1-1,1,1-3,"1,(0-0) >X",OO,BOS,Sandy Leon,Aaron Nola,-15%,50%,Double Play: Lineout: 2B (2B-1B); Holt out at 1B/2B-1B
b8,1-1,0,---,"3,(0-2) CFX",,BOS,Brock Holt,Aaron Nola,13%,74%,Double to LF (Line Drive to Deep LF)
