Inn,Score,Out,RoB,Pit(cnt),R/O,@Bat,Batter,Pitcher,wWPA,wWE,Play Description
b3,2-3,2,123,"8,(3-2) BCCBF*B>F>X",RRRR,BOS,Xander Bogaerts,Jason Hammel,35%,82%,Home Run (Fly Ball to Deep LF Line); Ramirez Scores; Martinez Scores; Moreland Scores
t4,4-6,1,-2-,"4,(2-1) BFBX",R,KCR,Whit Merrifield,Eduardo Rodriguez,-11%,60%,Double to LF (Line Drive to LF Line); Escobar Scores
b3,1-3,2,123,"8,(3-2) CS*BB*B>F>F>B",R,BOS,Mitch Moreland,Jason Hammel,11%,47%,Walk; Benintendi Scores; Ramirez to 3B; Martinez to 2B
t4,3-6,1,1--,"4,(1-2) BCFX",R,KCR,Alcides Escobar,Eduardo Rodriguez,-10%,71%,Double to LF (Line Drive to Deep LF-CF); Gordon Scores
t1,3-0,1,123,"1,(0-0) X",OO,KCR,Alex Gordon,Eduardo Rodriguez,9%,27%,Ground Ball Double Play: 2B-SS-1B
