Inn,Score,Out,RoB,Pit(cnt),R/O,@Bat,Batter,Pitcher,wWPA,wWE,Play Description
b2,0-0,1,-23,"1,(0-0) X",RR,BOS,Brian Daubach,Mike Mussina,11%,75%,Double (Line Drive to Deep CF-RF); Ramirez Scores/unER; O'Leary Scores
b2,0-0,0,1--,"5,(3-1) BCBBX",,BOS,Troy O'Leary,Mike Mussina,10%,69%,Double to CF (Line Drive to Deep CF); Ramirez to 3B
t2,0-0,0,1--,"3,(1-1) CBX",OO,NYY,Tino Martinez,Pedro Martinez,8%,54%,Ground Ball Double Play: SS-2B-1B
t6,0-3,1,12-,"3,(0-2) SFS",O,NYY,Derek Jeter,Pedro Martinez,5%,86%,Strikeout Swinging
b2,0-0,0,-23,"2,(1-0) BX",O,BOS,Shea Hillenbrand,Mike Mussina,-5%,64%,Foul Popfly: 1B (1B into Foul Terr.)
