Inn,Score,Out,RoB,Pit(cnt),R/O,@Bat,Batter,Pitcher,wWPA,wWE,Play Description
t3,1-1,2,1--,"1,(0-0) X",R,TOR,Carlos Delgado,Tim Wakefield,12%,59%,Double to CF (Fly Ball to Short CF-RF); Kielty Scores
t3,2-1,2,-2-,"3,(0-2) SFX",R,TOR,Greg Myers,Tim Wakefield,10%,68%,Single to RF (Line Drive); Delgado Scores; Myers to 2B/Adv on throw
b2,0-1,2,1-3,"5,(2-2) SBBSX",R,BOS,Doug Mirabelli,Kelvim Escobar,-9%,46%,Single to CF (Ground Ball thru Deep SS-2B); Millar Scores; Mueller to 2B
t6,3-1,1,---,"2,(1-0) BX",R,TOR,Mike Bordick,Tim Wakefield,9%,84%,Home Run (Fly Ball to Deep LF)
t1,0-0,0,123,"2,(0-1) CX",ROO,TOR,Carlos Delgado,Tim Wakefield,-8%,58%,Ground Ball Double Play: 2B-SS-1B; Johnson Scores; Catalanotto to 3B
