Inn,Score,Out,RoB,Pit(cnt),R/O,@Bat,Batter,Pitcher,wWPA,wWE,Play Description
b1,0-0,0,1--,"1,(0-0) X",,BOS,Bill Mueller,Omar Daal,9%,68%,Double to LF (Line Drive); Damon to 3B
b2,2-0,0,---,"2,(1-0) BX",R,BOS,Jason Varitek,Omar Daal,7%,81%,Home Run (Fly Ball to Deep CF)
b2,4-0,1,1-3,"6,(3-2) FBBB>C.>X",RRR,BOS,Nomar Garciaparra,Omar Daal,6%,96%,Home Run (Fly Ball to Deep LF); Jackson Scores; Mueller Scores
b2,3-0,0,-2-,"4,(0-2) CCFX",R,BOS,Damian Jackson,Omar Daal,5%,89%,Double to LF (Ground Ball); Kapler Scores
t2,0-2,2,12-,"3,(0-2) CSS",O,BAL,Jack Cust,Derek Lowe,4%,74%,Strikeout Swinging
