Inn,Score,Out,RoB,Pit(cnt),R/O,@Bat,Batter,Pitcher,wWPA,wWE,Play Description
b3,0-1,1,12-,"2,(1-0) BX",RR,BOS,Nomar Garciaparra,Charles Nagy,20%,70%,Triple to CF (Line Drive to Deep CF); Nixon Scores; Varitek Scores
b3,2-1,2,--3,"1,(0-0) X",RR,BOS,Dante Bichette,Charles Nagy,15%,80%,Home Run (Fly Ball to Deep LF); Garciaparra Scores
t4,1-4,2,123,"4,(0-2) FSFX",O,CLE,Kenny Lofton,Tomo Ohka,8%,84%,Flyball: CF
b1,0-0,2,123,"2,(1-0) BX",O,BOS,Dante Bichette,Charles Nagy,-7%,50%,Flyball: CF
b1,0-0,1,123,"1,(0-0) X",O,BOS,Troy O'Leary,Charles Nagy,-7%,57%,Groundout: P-C/Forceout at Hm; Varitek to 3B; Garciaparra to 2B
