Inn,Score,Out,RoB,Pit(cnt),R/O,@Bat,Batter,Pitcher,wWPA,wWE,Play Description
b2,0-0,1,123,"4,(1-2) BFCX",RR,BOS,Bill Mueller,Jamie Moyer,14%,79%,Single to RF (Fly Ball to RF Line); Ortiz Scores; Varitek Scores; Payton to 3B
b2,0-0,0,---,"5,(2-2) BFBFX",,BOS,David Ortiz,Jamie Moyer,6%,61%,Double to LF (Fly Ball)
b3,4-0,1,12-,"2,(1-0) BX",RR,BOS,Bill Mueller,Jamie Moyer,6%,96%,Double to LF (Line Drive to LF Line); Millar Scores; Payton Scores
b3,3-0,0,---,"6,(2-2) SBBFFX",R,BOS,David Ortiz,Jamie Moyer,6%,89%,Home Run (Fly Ball to Deep RF)
b2,0-0,1,-2-,"3,(1-1) C*BX",,BOS,Jason Varitek,Jamie Moyer,5%,62%,Single to 3B (Ground Ball); Ortiz to 3B
