Inn,Score,Out,RoB,Pit(cnt),R/O,@Bat,Batter,Pitcher,wWPA,wWE,Play Description
b1,0-0,2,12-,"4,(1-2) FSBX",RR,BOS,Jason Varitek,Matt Morris,17%,71%,Triple to CF (Fly Ball); Ramirez Scores; Ortiz Scores
b4,2-1,2,-23,"2,(1-0) *BX",RR,BOS,Mark Bellhorn,Matt Morris,15%,84%,Double to CF (Fly Ball); Millar Scores; Mueller Scores
t2,0-2,1,12-,"4,(2-1) BBF>X",OO,STL,Mike Matheny,Curt Schilling,9%,74%,Line Drive Double Play: 3B unassisted; Sanders out at 2B/3B
t4,0-2,2,--3,"2,(0-1) FX",R,STL,Reggie Sanders,Curt Schilling,-8%,65%,Reached on E5 (Ground Ball); Pujols Scores/unER/No RBI
b6,4-1,2,12-,"7,(2-2) BSCFF*BX",RR,BOS,Orlando Cabrera,Cal Eldred,7%,96%,Single to LF (Fly Ball); Nixon Scores; Damon Scores
