Inn,Score,Out,RoB,Pit(cnt),R/O,@Bat,Batter,Pitcher,wWPA,wWE,Play Description
t3,1-6,2,1-3,"5,(1-2) CBCFX",RR,OAK,Scott Hatteberg,Pedro Martinez,-10%,79%,Double to LF (Fly Ball); Scutaro Scores; McLemore Scores/Adv on E7/No RBI/unER; Hatteberg to 3B
b1,0-0,1,---,"2,(0-1) CX",R,BOS,Mark Bellhorn,Mark Redman,9%,62%,Home Run (Fly Ball to Deep LF)
b2,1-0,0,---,"4,(1-2) FBFX",R,BOS,Nomar Garciaparra,Mark Redman,9%,74%,Home Run (Fly Ball to Deep CF)
b2,2-0,0,-2-,"6,(3-2) CCB.*BBX",R,BOS,Jason Varitek,Mark Redman,6%,84%,Double to RF (Ground Ball thru RF Line); Millar Scores
b2,4-0,1,12-,"5,(2-2) CBBFX",RR,BOS,Mark Bellhorn,Mark Redman,6%,94%,Single to 3B (Ground Ball); Mueller Scores/Adv on E5 (throw)/No RBI; Damon Scores/No RBI/unER
