Inn,Score,Out,RoB,Pit(cnt),R/O,@Bat,Batter,Pitcher,wWPA,wWE,Play Description
b1,0-1,0,12-,"3,(1-1) CBX",R,BOS,Israel Alcantara,Steve Woodard,13%,68%,Single to CF (Line Drive to Short CF); Offerman Scores; Nixon to 3B; Alcantara to 2B/Adv on throw
b7,8-7,0,1--,"5,(2-2) BFCBX",RR,BOS,Trot Nixon,Ryan Drese,13%,94%,Home Run (Fly Ball to Deep CF); Offerman Scores
t1,0-0,1,12-,"2,(1-0) BX",R,CLE,Juan Gonzalez,Casey Fossum,-11%,35%,Single to RF (Line Drive); Cabrera Scores/unER; Vizquel to 3B
t1,1-0,1,1-3,"2,(1-0) BX",OO,CLE,Ellis Burks,Casey Fossum,10%,45%,Ground Ball Double Play: 3B-2B-1B
t7,6-8,2,-2-,"4,(1-2) CBFX",R,CLE,Travis Fryman,Derek Lowe,-10%,74%,Single to LF (Ground Ball thru Short LF); Burks Scores
