Inn,Score,Out,RoB,Pit(cnt),R/O,@Bat,Batter,Pitcher,wWPA,wWE,Play Description
b1,2-0,2,-23,"4,(2-1) CBBX",RR,BOS,Mike Lowell,Josh Towers,11%,84%,Double to LF (Ground Ball thru LF Line); Nixon Scores; Varitek Scores
b1,1-0,2,1-3,"3,(1-1) SBX",R,BOS,Jason Varitek,Josh Towers,9%,73%,Double to RF (Fly Ball to Deep RF); Ortiz Scores; Nixon to 3B
b1,0-0,1,12-,"5,(3-1) FBBBB",,BOS,Manny Ramirez,Josh Towers,5%,64%,Walk; Loretta to 3B; Ortiz to 2B
b1,4-0,2,-2-,"2,(1-0) BX",R,BOS,Wily Mo Peña,Josh Towers,4%,88%,Single to LF (Line Drive); Lowell Scores
b6,5-1,2,-2-,"5,(2-2) BCFBX",RR,BOS,Kevin Youkilis,Josh Towers,4%,98%,Home Run (Fly Ball to Deep LF); Lowell Scores
