Inn,Score,Out,RoB,Pit(cnt),R/O,@Bat,Batter,Pitcher,wWPA,wWE,Play Description
b7,2-4,0,1-3,"4,(1-2) S*BCX",ROO,BOS,Trot Nixon,José Contreras,16%,70%,Ground Ball Double Play: 2B-SS-1B; Ortiz Scores/No RBI
b7,2-4,0,1--,"3,(1-1) .SBX",,BOS,Kevin Millar,José Contreras,-15%,54%,Single to CF (Line Drive); Ortiz to 3B
b6,2-4,1,12-,"5,(2-2) BBFSX",OO,BOS,Manny Ramirez,Roger Clemens,14%,80%,Ground Ball Double Play: SS-2B-1B
t4,2-2,0,1-3,"1,(0-0) X",R,NYY,Hideki Matsui,Pedro Martinez,11%,75%,Ground-rule Double (Line Drive); Posada Scores; Johnson to 3B
t3,1-2,1,---,"1,(0-0) X",R,NYY,Derek Jeter,Pedro Martinez,11%,47%,Home Run (Fly Ball)
