Inn,Score,Out,RoB,Pit(cnt),R/O,@Bat,Batter,Pitcher,wWPA,wWE,Play Description
t1,0-0,1,12-,"4,(2-1) BBCX",RRR,BAL,Chris Richard,Frank Castillo,20%,74%,Home Run (Fly Ball to Deep RF); Bigbie Scores; Conine Scores
b8,5-8,0,1--,"3,(1-1) BSX",RR,BOS,Shea Hillenbrand,John Wasdin,-18%,68%,Home Run (Fly Ball to Deep LF); Alcantara Scores
b8,7-8,2,1-3,"6,(3-2) CBBBFX",O,BOS,Manny Ramirez,B.J. Ryan,15%,83%,Groundout: 2B-1B
b7,5-8,1,1-3,"3,(0-2) SSX",OO,BOS,Calvin Pickering,John Wasdin,14%,92%,Ground Ball Double Play: 3B-2B-1B
b8,7-8,1,12-,"2,(0-1) CX",O,BOS,Trot Nixon,B.J. Ryan,10%,68%,Flyball: LF; Offerman to 3B
