Inn,Score,Out,RoB,Pit(cnt),R/O,@Bat,Batter,Pitcher,wWPA,wWE,Play Description
t4,1-2,1,1--,"3,(1-1) C*BX",RR,BAL,Tony Batista,Tim Wakefield,-20%,41%,Home Run (Fly Ball to Deep LF); Gibbons Scores
b8,3-3,0,1--,"2,(0-1) .1FX",,BOS,David Ortiz,Travis Driskill,17%,84%,Single to LF (Fly Ball); Jackson to 3B
b6,2-3,0,---,"5,(2-2) BCBFX",R,BOS,Manny Ramirez,Damian Moss,17%,58%,Home Run (Fly Ball to Deep LF)
b3,0-0,0,123,"3,(2-0) BBX",RR,BOS,Bill Mueller,Damian Moss,12%,85%,Double to LF (Fly Ball to LF-CF); Walker Scores; Mirabelli Scores; Damon to 3B
b5,2-3,0,1--,"6,(3-2) B1BBCC1>X",OO,BOS,Bill Mueller,Damian Moss,-11%,37%,Ground Ball Double Play: 3B-2B-1B
