Inn,Score,Out,RoB,Pit(cnt),R/O,@Bat,Batter,Pitcher,wWPA,wWE,Play Description
b2,0-0,0,123,"6,(3-2) CB*BBSX",RR,BOS,Bill Mueller,Jeremy Bonderman,12%,83%,Double to LF (Line Drive to Deep LF); Ramirez Scores; Millar Scores; Nixon to 3B
b2,0-0,0,1--,"2,(1-0) *BX",,BOS,Kevin Millar,Jeremy Bonderman,10%,69%,Double to LF (Ground Ball thru Deep 3B); Ramirez to 3B
b2,4-0,2,1--,"2,(1-0) 1B>X",R,BOS,Todd Walker,Jeremy Bonderman,5%,90%,Double to LF (Line Drive to LF Line); Damon Scores
b2,2-0,0,-23,"5,(3-1) BFB*BX",RR,BOS,Jeremy Giambi,Jeremy Bonderman,5%,88%,Single to RF (Ground Ball thru Deep 2B-1B); Nixon Scores; Mueller Scores
b2,0-0,0,---,"2,(1-0) BX",,BOS,Manny Ramirez,Jeremy Bonderman,4%,59%,Single to LF (Line Drive to Deep LF)
