Inn,Score,Out,RoB,Pit(cnt),R/O,@Bat,Batter,Pitcher,wWPA,wWE,Play Description
b6,2-3,2,1--,"4,(1-2) BSFX",R,BOS,Troy O'Leary,Rheal Cormier,19%,55%,Double (Line Drive to Deep LF-CF); Bichette Scores
b6,3-3,2,-2-,"1,(0-0) X",R,BOS,Brian Daubach,Rheal Cormier,17%,72%,Double to LF (Line Drive to LF Line); O'Leary Scores
t5,1-1,0,1--,"5,(2-2) BFFBX",,PHI,Eric Valent,Hideo Nomo,-13%,32%,Double (Line Drive to CF-RF); Burrell to 3B
b4,0-1,1,---,"3,(0-2) CSX",R,BOS,Dante Bichette,Robert Person,13%,53%,Home Run (Fly Ball to Deep LF)
b6,1-3,2,---,"3,(1-1) CBX",R,BOS,Carl Everett,Robert Person,13%,34%,Home Run (Fly Ball to Deep RF)
