Inn,Score,Out,RoB,Pit(cnt),R/O,@Bat,Batter,Pitcher,wWPA,wWE,Play Description
t8,2-3,2,-2-,"3,(2-0) *BBX",RR,COL,Charlie Blackmon,Brandon Workman,45%,68%,Home Run (Fly Ball to Deep CF); Iannetta Scores
t11,4-4,2,12-,"3,(0-2) CSX",R,COL,Mark Reynolds,Ryan Brasier,34%,81%,Single to CF (Line Drive); Story Scores; Arenado to 2B
b8,3-4,1,12-,"7,(3-2) .BBSFF*BX",R,BOS,Mitch Moreland,Scott Oberg,-32%,25%,Single to CF (Line Drive to Deep CF-RF); Devers Scores/unER; Chavis to 3B
b8,4-4,1,1-3,"2,(0-1) FX",OO,BOS,Eduardo Nunez,Scott Oberg,25%,50%,Double Play: Lineout: 2B; Moreland out at 1B/2B-1B
t7,0-3,0,1--,"4,(2-1) BSBX",RR,COL,Nolan Arenado,Chris Sale,16%,32%,Home Run (Fly Ball to Deep LF); Story Scores
